 ID-EVENTO;TITULO;PRECIO;GRATUITO;LARGA-DURACION;DIAS-SEMANA;DIAS-EXCLUIDOS;FECHA;FECHA-FIN;HORA;DESCRIPCION;CONTENT-URL;TITULO-ACTIVIDAD;URL-ACTIVIDAD;URL-INSTALACION;NOMBRE-INSTALACION;ACCESIBILIDAD-INSTALACION;CLASE-VIAL-INSTALACION;NOMBRE-VIA-INSTALACION;NUM-INSTALACION;DISTRITO-INSTALACION;BARRIO-INSTALACION;CODIGO-POSTAL-INSTALACION;COORDENADA-X;COORDENADA-Y;LATITUD;LONGITUD;TIPO;AUDIENCIA;
11308237;"Os Fenómenos";"";"1";"0";"";"";"2021-02-16 00:00:00.0";"2021-02-16 23:59:00.0";"18:00";"";"http://www.madrid.es/sites/v/index.jsp?vgnextchannel=ca9671ee4a9eb410VgnVCM100000171f5a0aRCRD&vgnextoid=f1ef93d918937710VgnVCM2000001f4a900aRCRD";"Os Fenómenos";"http://www.madrid.es/sites/v/index.jsp?vgnextchannel=ca9671ee4a9eb410VgnVCM100000171f5a0aRCRD&vgnextoid=4c9a525217937710VgnVCM1000001d4a900aRCRD";"";"";"";"";"";"";"";"";"";"";"";"";"";"/contenido/actividades/CineActividadesAudiovisuales/CineFiccion";"";
11314316;"Ota, la gota triste";"";"1";"0";"";"";"2021-02-05 00:00:00.0";"2021-02-05 23:59:00.0";"17:30";"A cargo de la compañía Ñas Teatro. El doctor Manzano ha descubierto por qué las gotas de agua están tristes y sólo con vuestra ayuda conseguirán devolverles la sonrisa. Una historia que ayuda a concienciar a niños y grandes sobre el consumo responsable del agua utilizando objetos reutilizados y manipulándolos en forma de teatrillo. Edad recomendada: a partir de 4 años.";"http://www.madrid.es/sites/v/index.jsp?vgnextchannel=ca9671ee4a9eb410VgnVCM100000171f5a0aRCRD&vgnextoid=b80adeed71947710VgnVCM2000001f4a900aRCRD";"Actividades en el Centro Sociocultural Tetuán";"http://www.madrid.es/sites/v/index.jsp?vgnextchannel=ca9671ee4a9eb410VgnVCM100000171f5a0aRCRD&vgnextoid=4c2be3e2a7103610VgnVCM1000001d4a900aRCRD";"http://www.madrid.es/sites/v/index.jsp?vgnextchannel=bfa48ab43d6bb410VgnVCM100000171f5a0aRCRD&vgnextoid=0ecb1e79ee71c010VgnVCM1000000b205a0aRCRD";"Centro Sociocultural Tetuán";"1";"CALLE";"BRAVO MURILLO";"251";"TETUAN";"BERRUGUETE";"28020";"440628";"4478947";"40.45907130615822";"-3.700271645324868";"/contenido/actividades/TeatroPerformance";"";
11203856;"Otelo";"20?";"0";"1";"X,J,V,S,D";"";"2021-05-05 00:00:00.0";"2021-05-09 23:59:00.0";"";"";"http://www.madrid.es/sites/v/index.jsp?vgnextchannel=ca9671ee4a9eb410VgnVCM100000171f5a0aRCRD&vgnextoid=5f5c8d9025e53710VgnVCM1000001d4a900aRCRD";"";"";"http://www.madrid.es/sites/v/index.jsp?vgnextchannel=bfa48ab43d6bb410VgnVCM100000171f5a0aRCRD&vgnextoid=4582ee06ea5ee310VgnVCM2000000c205a0aRCRD";"Naves Español en Matadero";"1";"PASEO";"CHOPERA";"14";"ARGANZUELA";"CHOPERA";"28045";"440825";"4471546";"40.39241374953321";"-3.697247685884226";"/contenido/actividades/ProgramacionDestacadaAgendaCultura";"";
11276690;"Pablo Milanés";"";"0";"0";"";"";"2021-02-03 00:00:00.0";"2021-02-03 23:59:00.0";"19:00";"";"http://www.madrid.es/sites/v/index.jsp?vgnextchannel=ca9671ee4a9eb410VgnVCM100000171f5a0aRCRD&vgnextoid=869ccd39d2e16710VgnVCM1000001d4a900aRCRD";"Pablo Milanés";"http://www.madrid.es/sites/v/index.jsp?vgnextchannel=ca9671ee4a9eb410VgnVCM100000171f5a0aRCRD&vgnextoid=0b9ccd39d2e16710VgnVCM1000001d4a900aRCRD";"http://www.madrid.es/sites/v/index.jsp?vgnextchannel=bfa48ab43d6bb410VgnVCM100000171f5a0aRCRD&vgnextoid=432257258ae5d010VgnVCM1000000b205a0aRCRD";"Teatro Circo Price";"1";"RONDA";"ATOCHA";"35";"ARGANZUELA";"PALOS DE MOGUER";"28012";"440723";"4473051";"40.40596423138839";"-3.698601359753866";"/contenido/actividades/ProgramacionDestacadaAgendaCultura";"";
11302151;"Paseo con otros ojos";"";"1";"1";"S";"";"2021-01-30 00:00:00.0";"2021-02-27 23:59:00.0";"10:00";"¿Te gustaría pasear por Madrid conociendo parte de su historia? Cada sábado se propondrán diferentes recorridos por Madrid visibilizando su memoria histórica.Los recorridos se realizan con grupos reducidos y las medidas de seguridad requeridas por sanidad. Para más información contacta con el Espacio de Igualdad María de Maeztu.";"http://www.madrid.es/sites/v/index.jsp?vgnextchannel=ca9671ee4a9eb410VgnVCM100000171f5a0aRCRD&vgnextoid=51fa5a22e5507710VgnVCM1000001d4a900aRCRD";"Paseamos, pensamos, compartimos";"http://www.madrid.es/sites/v/index.jsp?vgnextchannel=ca9671ee4a9eb410VgnVCM100000171f5a0aRCRD&vgnextoid=513e602433507710VgnVCM1000001d4a900aRCRD";"http://www.madrid.es/sites/v/index.jsp?vgnextchannel=bfa48ab43d6bb410VgnVCM100000171f5a0aRCRD&vgnextoid=63431203d9e85110VgnVCM1000000b205a0aRCRD";"Espacio de Igualdad María de Maeztu. Carabanchel";"1";"CALLE";"COMANDANTE FONTANES";"8";"CARABANCHEL";"SAN ISIDRO";"28019";"438746";"4471883";"40.395280262214236";"-3.7219395095828647";"/contenido/actividades/ExcursionesItinerariosVisitas";"/usuario/Mujeres";
11302179;"Paseo de Jane por Villa de Vallecas: buscando espacios seguros";"";"1";"1";"X";"10/2/2021;";"2021-02-03 00:00:00.0";"2021-02-17 23:59:00.0";"10:00";"Mujeres y hombres nos juntaremos para caminar por nuestro barrio, realizaremos ejercicio manteniéndonos en forma a la vez que conocemos otras personas y, siguiendo la metodología del Paseo de Jane, realizaremos diferentes recorridos por Villa de Vallecas para reivindicar las calles como espacio público de convivencia y encuentro, descubriremos nuestra ciudad desde otra perspectiva. 'Mirad, por favor, con detenimiento a las ciudades reales. Y mientras miráis, también podríais escuchar, quedaros un rato y pensar en lo que veis'Jane Jacobs, ?Muerte y vida de las grandes ciudades?. Miércoles alternos de 10 a 11:30 horas.Dirigida a población general.Modalidad presencial.";"http://www.madrid.es/sites/v/index.jsp?vgnextchannel=ca9671ee4a9eb410VgnVCM100000171f5a0aRCRD&vgnextoid=33515a22e5507710VgnVCM1000001d4a900aRCRD";"Paseamos, pensamos, compartimos";"http://www.madrid.es/sites/v/index.jsp?vgnextchannel=ca9671ee4a9eb410VgnVCM100000171f5a0aRCRD&vgnextoid=513e602433507710VgnVCM1000001d4a900aRCRD";"http://www.madrid.es/sites/v/index.jsp?vgnextchannel=bfa48ab43d6bb410VgnVCM100000171f5a0aRCRD&vgnextoid=67132bfd4f975710VgnVCM1000001d4a900aRCRD";"Espacio de Igualdad María Moliner. Villa de Vallecas";"1";"CALLE";"HONRUBIA";"4";"VILLA DE VALLECAS";"ENSANCHE DE VALLECAS";"28031";"446579";"4469157";"40.37128211425518";"-3.6292460351699867";"/contenido/actividades/ExcursionesItinerariosVisitas";"";
11302108;"Paseo emocional. Reapropiándome de mi entorno";"";"1";"0";"";"";"2021-02-12 00:00:00.0";"2021-02-12 23:59:00.0";"09:30";"Nuestra relación con el territorio que habitamos y vivimos está atravesada por una historia de emociones e invisibilidades. ¿Hay lugares de mi barrio en los que alguna vez me he sentido insegura? ¿Qué zonas de mi barrio me traen buenos recuerdos? ¿En cuáles me siento cómoda? ¿En qué zonas siento que formo parte activa del entorno y en cuáles no?.Ven a compartir con tus vecinas este paseo en el que nos apropiamos del espacio que recorremos, a la vez que nos activamos, potenciamos nuestra autonomía y salimos de las cargas del espacio privado.Tráete ropa y calzado cómodo para este paseo 'emocionante'. Se solicita inscripción previa. Viernes 12 de febrero de 9:30 a 10:30 h.Actividad presencial con aforo limitado.";"http://www.madrid.es/sites/v/index.jsp?vgnextchannel=ca9671ee4a9eb410VgnVCM100000171f5a0aRCRD&vgnextoid=c9c25418b3507710VgnVCM1000001d4a900aRCRD";"Paseamos, pensamos, compartimos";"http://www.madrid.es/sites/v/index.jsp?vgnextchannel=ca9671ee4a9eb410VgnVCM100000171f5a0aRCRD&vgnextoid=513e602433507710VgnVCM1000001d4a900aRCRD";"http://www.madrid.es/sites/v/index.jsp?vgnextchannel=bfa48ab43d6bb410VgnVCM100000171f5a0aRCRD&vgnextoid=6a38fb412e9a2610VgnVCM2000001f4a900aRCRD";"Espacio de Igualdad Berta Cáceres. Usera";"1";"CALLE";"GRAN AVENIDA";"14";"USERA";"ORCASITAS";"28041";"439703";"4468958";"40.36902428128397";"-3.710212677306876";"/contenido/actividades/ExcursionesItinerariosVisitas";"/usuario/Mujeres";
11302222;"Paseos en calle de mujer. Lyceum club y Ateneo. Generación del 27";"";"1";"0";"";"";"2021-02-15 00:00:00.0";"2021-02-15 23:59:00.0";"11:00";"Seguimos con los paseos, reescribiendo las huellas borradas del Madrid con historias de mujeres. Esta vez visitamos lugares emblemáticos para el desarrollo cultural, político de las mujeres: el Lyceum club femenino y el Ateneo de Madrid. Vamos a conocer espacios donde habitaron mujeres imprescindibles de la generación del 27. Lunes 15 de febrero de 11 a 12:30h. Actividad para mujeres. Necesaria inscripción previa. Modalidad presencial";"http://www.madrid.es/sites/v/index.jsp?vgnextchannel=ca9671ee4a9eb410VgnVCM100000171f5a0aRCRD&vgnextoid=1368c139e6507710VgnVCM1000001d4a900aRCRD";"Paseamos, pensamos, compartimos";"http://www.madrid.es/sites/v/index.jsp?vgnextchannel=ca9671ee4a9eb410VgnVCM100000171f5a0aRCRD&vgnextoid=513e602433507710VgnVCM1000001d4a900aRCRD";"http://www.madrid.es/sites/v/index.jsp?vgnextchannel=bfa48ab43d6bb410VgnVCM100000171f5a0aRCRD&vgnextoid=e58c855a64315610VgnVCM2000001f4a900aRCRD";"Espacio de Igualdad Nieves Torres. Chamartín";"1";"CALLE";"ENRIQUE JARDIEL PONCELA";"8";"CHAMARTIN";"NUEVA ESPAÑA";"28016";"443189";"4479129";"40.46088981165102";"-3.6700689174427326";"/contenido/actividades/ExcursionesItinerariosVisitas";"/usuario/Mujeres";
11302199;"Paseos para tejer redes entre nosotras";"";"1";"1";"X";"";"2021-02-03 00:00:00.0";"2021-02-24 23:59:00.0";"17:00";"Te ofrecemos la posibilidad de un paseo saludable con una facilitadora y algunas compañeras del Espacio. Dirigido a mujeres que necesiten relacionarse, salir a dar un paseo y compartir un espacio al aire libre. La participación en el paseo será gestionada bajo criterio del equipo técnico del Espacio de Igualdad.    Mañanas: Lunes 1, 8, 15 y 22 de febrero a las 12h. Tardes: miércoles 3, 10, 17 y 24 de febrero a las 17h.   *Aforo máximo de 5 personas en todos los talleres presenciales.*rotación de mujeres en los diferentes paseos";"http://www.madrid.es/sites/v/index.jsp?vgnextchannel=ca9671ee4a9eb410VgnVCM100000171f5a0aRCRD&vgnextoid=a98b3c9666507710VgnVCM1000001d4a900aRCRD";"Paseamos, pensamos, compartimos";"http://www.madrid.es/sites/v/index.jsp?vgnextchannel=ca9671ee4a9eb410VgnVCM100000171f5a0aRCRD&vgnextoid=513e602433507710VgnVCM1000001d4a900aRCRD";"http://www.madrid.es/sites/v/index.jsp?vgnextchannel=bfa48ab43d6bb410VgnVCM100000171f5a0aRCRD&vgnextoid=fe74849c67261510VgnVCM1000000b205a0aRCRD";"Espacio de Igualdad María Telo. Moratalaz";"2";"CALLE";"CAMINO DE LOS VINATEROS";"51";"MORATALAZ";"MEDIA LEGUA";"28030";"444520";"4473567";"40.41087442118042";"-3.6538891267077664";"/contenido/actividades/ExcursionesItinerariosVisitas";"/usuario/Mujeres";
11302184;"Paseos para tejer redes entre nosotras";"";"1";"1";"L";"";"2021-02-01 00:00:00.0";"2021-02-22 23:59:00.0";"12:00";"Te ofrecemos la posibilidad de un paseo saludable con una facilitadora y algunas compañeras del Espacio. Dirigido a mujeres que necesiten relacionarse, salir a dar un paseo y compartir un espacio al aire libre. La participación en el paseo será gestionada bajo criterio del equipo técnico del Espacio de Igualdad.    Mañanas: lunes 1, 8, 15 y 22 de febrero a las 12h. Tardes: miércoles 3, 10, 17 y 24 de febrero a las 17h.   *Aforo máximo de 5 personas en todos los talleres presenciales.*rotación de mujeres en los diferentes paseos";"http://www.madrid.es/sites/v/index.jsp?vgnextchannel=ca9671ee4a9eb410VgnVCM100000171f5a0aRCRD&vgnextoid=54083c9666507710VgnVCM1000001d4a900aRCRD";"Paseamos, pensamos, compartimos";"http://www.madrid.es/sites/v/index.jsp?vgnextchannel=ca9671ee4a9eb410VgnVCM100000171f5a0aRCRD&vgnextoid=513e602433507710VgnVCM1000001d4a900aRCRD";"http://www.madrid.es/sites/v/index.jsp?vgnextchannel=bfa48ab43d6bb410VgnVCM100000171f5a0aRCRD&vgnextoid=fe74849c67261510VgnVCM1000000b205a0aRCRD";"Espacio de Igualdad María Telo. Moratalaz";"2";"CALLE";"CAMINO DE LOS VINATEROS";"51";"MORATALAZ";"MEDIA LEGUA";"28030";"444520";"4473567";"40.41087442118042";"-3.6538891267077664";"/contenido/actividades/ExcursionesItinerariosVisitas";"/usuario/Mujeres";
11313809;"Patito... ¿Patoso? - Títeres Sol y Tierra";"";"1";"1";"L,M,X,J,V,S,D";"";"2021-02-06 00:00:00.0";"2021-02-07 23:59:00.0";"";"";"http://www.madrid.es/sites/v/index.jsp?vgnextchannel=ca9671ee4a9eb410VgnVCM100000171f5a0aRCRD&vgnextoid=3022c1b969847710VgnVCM2000001f4a900aRCRD";"";"";"";"";"";"";"";"";"";"";"";"";"";"";"";"/contenido/actividades/CuentacuentosTiteresMarionetas";"/usuario/Niños";
11224290;"Patrick Hamilton: 'El invernadero rojo'";"";"0";"1";"L,M,X,J,V,S,D";"";"2021-02-03 00:00:00.0";"2021-05-02 23:59:00.0";"";"";"http://www.madrid.es/sites/v/index.jsp?vgnextchannel=ca9671ee4a9eb410VgnVCM100000171f5a0aRCRD&vgnextoid=c0407ca1f2ea4710VgnVCM1000001d4a900aRCRD";"Patrick Hamilton: 'El invernadero rojo'";"http://www.madrid.es/sites/v/index.jsp?vgnextchannel=ca9671ee4a9eb410VgnVCM100000171f5a0aRCRD&vgnextoid=35407ca1f2ea4710VgnVCM1000001d4a900aRCRD";"http://www.madrid.es/sites/v/index.jsp?vgnextchannel=bfa48ab43d6bb410VgnVCM100000171f5a0aRCRD&vgnextoid=64463d0b5e71c010VgnVCM1000000b205a0aRCRD";"Conde Duque";"1";"CALLE";"CONDE DUQUE";"11";"CENTRO";"UNIVERSIDAD";"28015";"439759";"4475508";"40.42802889001877";"-3.710182353581842";"/contenido/actividades/ProgramacionDestacadaAgendaCultura";"";
11307155;"Pedro Obregón";"";"1";"0";"";"";"2021-01-31 00:00:00.0";"2021-01-31 23:59:00.0";"19:00";"";"http://www.madrid.es/sites/v/index.jsp?vgnextchannel=ca9671ee4a9eb410VgnVCM100000171f5a0aRCRD&vgnextoid=6f9edf12f1a27710VgnVCM1000001d4a900aRCRD";"";"";"http://www.madrid.es/sites/v/index.jsp?vgnextchannel=bfa48ab43d6bb410VgnVCM100000171f5a0aRCRD&vgnextoid=add63d0b5e71c010VgnVCM1000000b205a0aRCRD";"Centro Cultural Pozo del tío Raimundo (Puente de Vallecas)";"1";"AVENIDA";"DE LAS GLORIETAS";"19";"PUENTE DE VALLECAS";"ENTREVIAS";"28053";"443950";"4469433";"40.3735856436473";"-3.6602546064905397";"/contenido/actividades/Musica/Flamenco";"";
11224361;"Perfect Blue";"";"0";"0";"";"";"2021-06-09 00:00:00.0";"2021-06-09 23:59:00.0";"19:30";"";"http://www.madrid.es/sites/v/index.jsp?vgnextchannel=ca9671ee4a9eb410VgnVCM100000171f5a0aRCRD&vgnextoid=bc627ca1f2ea4710VgnVCM1000001d4a900aRCRD";"";"";"http://www.madrid.es/sites/v/index.jsp?vgnextchannel=bfa48ab43d6bb410VgnVCM100000171f5a0aRCRD&vgnextoid=64463d0b5e71c010VgnVCM1000000b205a0aRCRD";"Conde Duque";"1";"CALLE";"CONDE DUQUE";"11";"CENTRO";"UNIVERSIDAD";"28015";"439759";"4475508";"40.42802889001877";"-3.710182353581842";"/contenido/actividades/ProgramacionDestacadaAgendaCultura";"";
11296678;"Periplo Varieté";"";"0";"0";"";"";"2021-01-31 00:00:00.0";"2021-01-31 23:59:00.0";"12:00";"";"http://www.madrid.es/sites/v/index.jsp?vgnextchannel=ca9671ee4a9eb410VgnVCM100000171f5a0aRCRD&vgnextoid=5fea05ab103b6710VgnVCM2000001f4a900aRCRD";"";"";"http://www.madrid.es/sites/v/index.jsp?vgnextchannel=bfa48ab43d6bb410VgnVCM100000171f5a0aRCRD&vgnextoid=340ed2d6fe9a6110VgnVCM1000000b205a0aRCRD";"Centro Cultural Fernando Lázaro Carreter (Carabanchel)";"1";"CALLE";"VERDAD";"29";"CARABANCHEL";"OPAÑEL";"28019";"439136";"4471474";"40.39164343238081";"-3.717140510927299";"/contenido/actividades/CuentacuentosTiteresMarionetas";"/usuario/Niños";
11274999;"Perreo: placer y poder animal";"3 euros";"0";"0";"";"";"2021-04-10 00:00:00.0";"2021-04-10 23:59:00.0";"18:00";"";"http://www.madrid.es/sites/v/index.jsp?vgnextchannel=ca9671ee4a9eb410VgnVCM100000171f5a0aRCRD&vgnextoid=44d32a281e906710VgnVCM1000001d4a900aRCRD";"";"";"http://www.madrid.es/sites/v/index.jsp?vgnextchannel=bfa48ab43d6bb410VgnVCM100000171f5a0aRCRD&vgnextoid=64463d0b5e71c010VgnVCM1000000b205a0aRCRD";"Conde Duque";"1";"CALLE";"CONDE DUQUE";"11";"CENTRO";"UNIVERSIDAD";"28015";"439759";"4475508";"40.42802889001877";"-3.710182353581842";"/contenido/actividades/ProgramacionDestacadaAgendaCultura";"";
11292705;"Personajes. ¿Quién vive o sufre lo que quiero contar?";"";"1";"0";"";"";"2021-03-04 00:00:00.0";"2021-03-04 23:59:00.0";"11:00";"";"http://www.madrid.es/sites/v/index.jsp?vgnextchannel=ca9671ee4a9eb410VgnVCM100000171f5a0aRCRD&vgnextoid=d44732d728986710VgnVCM2000001f4a900aRCRD";"Club de escritura. Centro Cultural Alfredo Kraus";"http://www.madrid.es/sites/v/index.jsp?vgnextchannel=ca9671ee4a9eb410VgnVCM100000171f5a0aRCRD&vgnextoid=c4905ace48154510VgnVCM1000001d4a900aRCRD";"http://www.madrid.es/sites/v/index.jsp?vgnextchannel=bfa48ab43d6bb410VgnVCM100000171f5a0aRCRD&vgnextoid=7337cbf06c81c010VgnVCM1000000b205a0aRCRD";"Centro Cultural Alfredo Kraus (Fuencarral - El Pardo)";"1";"GLORIETA";"PRADERA DE VAQUERIZAS";"9";"FUENCARRAL-EL PARDO";"MIRASIERRA";"28035";"438848";"4482487";"40.49082275610172";"-3.7216054330053647";"/contenido/actividades/CursosTalleres";"";
10631937;"Personajes. ¿Quién vive o sufre lo que quiero contar?";"";"1";"0";"";"";"2021-02-25 00:00:00.0";"2021-02-25 23:59:00.0";"11:00";"";"http://www.madrid.es/sites/v/index.jsp?vgnextchannel=ca9671ee4a9eb410VgnVCM100000171f5a0aRCRD&vgnextoid=ebfdd0b2571d1610VgnVCM1000001d4a900aRCRD";"Club de escritura. Centro Cultural Alfredo Kraus";"http://www.madrid.es/sites/v/index.jsp?vgnextchannel=ca9671ee4a9eb410VgnVCM100000171f5a0aRCRD&vgnextoid=c4905ace48154510VgnVCM1000001d4a900aRCRD";"http://www.madrid.es/sites/v/index.jsp?vgnextchannel=bfa48ab43d6bb410VgnVCM100000171f5a0aRCRD&vgnextoid=7337cbf06c81c010VgnVCM1000000b205a0aRCRD";"Centro Cultural Alfredo Kraus (Fuencarral - El Pardo)";"1";"GLORIETA";"PRADERA DE VAQUERIZAS";"9";"FUENCARRAL-EL PARDO";"MIRASIERRA";"28035";"438848";"4482487";"40.49082275610172";"-3.7216054330053647";"/contenido/actividades/CursosTalleres";"";
11294288;"Personajes. ¿Quién vive o sufre lo que quiero contar?";"";"1";"0";"";"";"2021-04-19 00:00:00.0";"2021-04-19 23:59:00.0";"17:00";"";"http://www.madrid.es/sites/v/index.jsp?vgnextchannel=ca9671ee4a9eb410VgnVCM100000171f5a0aRCRD&vgnextoid=4248d7f09af86710VgnVCM1000001d4a900aRCRD";"Club de escritura. Centro Sociocultural Valle Inclán";"http://www.madrid.es/sites/v/index.jsp?vgnextchannel=ca9671ee4a9eb410VgnVCM100000171f5a0aRCRD&vgnextoid=3c73af6a14401610VgnVCM1000001d4a900aRCRD";"http://www.madrid.es/sites/v/index.jsp?vgnextchannel=bfa48ab43d6bb410VgnVCM100000171f5a0aRCRD&vgnextoid=aa1c1e79ee71c010VgnVCM1000000b205a0aRCRD";"Centro Sociocultural Valle Inclán (Fuencarral - El Pardo)";"1";"CALLE";"ARZOBISPO MORCILLO";"7";"FUENCARRAL-EL PARDO";"LA PAZ";"28029";"441233";"4481384";"40.48106787416528";"-3.6933504628706095";"/contenido/actividades/CursosTalleres";"";
11294289;"Personajes. ¿Quién vive o sufre lo que quiero contar?";"";"1";"0";"";"";"2021-04-26 00:00:00.0";"2021-04-26 23:59:00.0";"17:00";"";"http://www.madrid.es/sites/v/index.jsp?vgnextchannel=ca9671ee4a9eb410VgnVCM100000171f5a0aRCRD&vgnextoid=4048d7f09af86710VgnVCM1000001d4a900aRCRD";"Club de escritura. Centro Sociocultural Valle Inclán";"http://www.madrid.es/sites/v/index.jsp?vgnextchannel=ca9671ee4a9eb410VgnVCM100000171f5a0aRCRD&vgnextoid=3c73af6a14401610VgnVCM1000001d4a900aRCRD";"http://www.madrid.es/sites/v/index.jsp?vgnextchannel=bfa48ab43d6bb410VgnVCM100000171f5a0aRCRD&vgnextoid=aa1c1e79ee71c010VgnVCM1000000b205a0aRCRD";"Centro Sociocultural Valle Inclán (Fuencarral - El Pardo)";"1";"CALLE";"ARZOBISPO MORCILLO";"7";"FUENCARRAL-EL PARDO";"LA PAZ";"28029";"441233";"4481384";"40.48106787416528";"-3.6933504628706095";"/contenido/actividades/CursosTalleres";"";
11224315;"Personal Shopper";"";"0";"0";"";"";"2021-02-17 00:00:00.0";"2021-02-17 23:59:00.0";"19:30";"";"http://www.madrid.es/sites/v/index.jsp?vgnextchannel=ca9671ee4a9eb410VgnVCM100000171f5a0aRCRD&vgnextoid=5ae07ca1f2ea4710VgnVCM1000001d4a900aRCRD";"";"";"http://www.madrid.es/sites/v/index.jsp?vgnextchannel=bfa48ab43d6bb410VgnVCM100000171f5a0aRCRD&vgnextoid=64463d0b5e71c010VgnVCM1000000b205a0aRCRD";"Conde Duque";"1";"CALLE";"CONDE DUQUE";"11";"CENTRO";"UNIVERSIDAD";"28015";"439759";"4475508";"40.42802889001877";"-3.710182353581842";"/contenido/actividades/ProgramacionDestacadaAgendaCultura";"";
11312442;"Piccolo hilo de circo";"";"1";"0";"";"";"2021-02-12 00:00:00.0";"2021-02-12 23:59:00.0";"18:30";"";"http://www.madrid.es/sites/v/index.jsp?vgnextchannel=ca9671ee4a9eb410VgnVCM100000171f5a0aRCRD&vgnextoid=3cdcfa33cb347710VgnVCM1000001d4a900aRCRD";"Piccolo hilo de circo";"http://www.madrid.es/sites/v/index.jsp?vgnextchannel=ca9671ee4a9eb410VgnVCM100000171f5a0aRCRD&vgnextoid=d0ecfa33cb347710VgnVCM1000001d4a900aRCRD";"http://www.madrid.es/sites/v/index.jsp?vgnextchannel=bfa48ab43d6bb410VgnVCM100000171f5a0aRCRD&vgnextoid=ee4a1e79ee71c010VgnVCM1000000b205a0aRCRD";"Centro Cultural Nicolás Salmerón (Chamartín)";"1";"CALLE";"MANTUANO";"51";"CHAMARTIN";"CIUDAD JARDIN";"28002";"442656";"4477714";"40.44810636195716";"-3.6762309620097398";"/contenido/actividades/1ciudad21distritos";"/usuario/Niños,/usuario/Familias";
11251408;"Pintura al Óleo";"";"1";"1";"L,M,X,J,V,S,D";"";"2020-11-01 00:00:00.0";"2021-02-28 23:59:00.0";"";"Exposición de Pintura al óleo de Manuel Martín Fontecha.";"http://www.madrid.es/sites/v/index.jsp?vgnextchannel=ca9671ee4a9eb410VgnVCM100000171f5a0aRCRD&vgnextoid=2c9cad8f4ff45710VgnVCM2000001f4a900aRCRD";"Exposiciones en los Centros Culturales de San Blas - Canillejas";"http://www.madrid.es/sites/v/index.jsp?vgnextchannel=ca9671ee4a9eb410VgnVCM100000171f5a0aRCRD&vgnextoid=59a5a24bc5770710VgnVCM2000001f4a900aRCRD";"http://www.madrid.es/sites/v/index.jsp?vgnextchannel=bfa48ab43d6bb410VgnVCM100000171f5a0aRCRD&vgnextoid=b790e37de110f210VgnVCM1000000b205a0aRCRD";"Centro Cultural José Luis López Vázquez (San Blas - Canillejas)";"1";"CALLE";"FEBRERO";"4";"SAN BLAS-CANILLEJAS";"REJAS";"28022";"451431";"4477509";"40.446818592300296";"-3.572741163820915";"/contenido/actividades/Exposiciones";"";
11302727;"Piratas Cia";"";"1";"0";"";"";"2021-02-27 00:00:00.0";"2021-02-27 23:59:00.0";"12:00";"PIRATAS CÍA. BAMBALÚA TEATRO Un corsario fanfarrón, una estudiante de la escuela de piratería y un grumete despistado, se enrolan en un galeón con el fin de cruzar los siete mares y llegar a la isla donde se esconde un magnífico tesoro. + 5 años.";"http://www.madrid.es/sites/v/index.jsp?vgnextchannel=ca9671ee4a9eb410VgnVCM100000171f5a0aRCRD&vgnextoid=cbd85f4e93317710VgnVCM1000001d4a900aRCRD";"Actividades en el Centro Cultural el Madroño";"http://www.madrid.es/sites/v/index.jsp?vgnextchannel=ca9671ee4a9eb410VgnVCM100000171f5a0aRCRD&vgnextoid=63fd7ba8c0950710VgnVCM1000001d4a900aRCRD";"http://www.madrid.es/sites/v/index.jsp?vgnextchannel=bfa48ab43d6bb410VgnVCM100000171f5a0aRCRD&vgnextoid=57b63d0b5e71c010VgnVCM1000000b205a0aRCRD";"Centro Cultural el Madroño (Vicálvaro)";"1";"CALLE";"VILLARDONDIEGO";"36";"VICALVARO";"CASCO H.VICALVARO";"28032";"448357";"4472920";"40.405292721436055";"-3.6086161200017157";"/contenido/actividades/TeatroPerformance";"/usuario/Niños";
